Class,No,Team,Drivers,Chassis,Engine,Laps
GT1.3,272,Jolly Club,Antonio Trenti Alberto Fasce,Lancia Fulvia HF,Lancia 1.6L V4,1
P3.0,20,Porsche System,Vic Elford Hans Herrmann,Porsche 908/03,Porsche 3.0L Flat-8,0
P3.0,32,Autodelta SpA,Umberto Maglioli Nanni Galli,Alfa Romeo T33/3,Alfa Romeo 3.0L V8,0
GT1.6,204,Antonio Guagliardo,Antonio La Luce Antonio Guagliardo,Abarth 2000S,Alfa Romeo 1.6L I4,0
P1.3,220,Jack Wheeler,Jack Wheeler Martin Davidson,Jerboa SP,BMC 1.3L I4,0
S1.3,234,Settecolli,Enzo Buzzetti Gianni Marini,Abarth 1300S,Abarth 1.6L I4,0
GT1.3,280,Scuderia Pegaso,Giuseppe Chiaramonte Giuseppe Spatafora,Lancia Fulvia HF,Lancia 1.6L V4,0
