Number,Builder,Type,Date,Works number,Notes,Dummy_Col_1
66,Electro-Motive Diesel,GP9m,1956,Unknown,Former C&O # 6145. Acquired 1998. Operational and in regular service.,wlKzwR
67,Electro-Motive Diesel,GP9m,6/1954,19554,built as Bangor and Aroostook Railroad # 77; acquired 1998; never delivered,zCCPHYB
M-80,Mack,Railbus,1923,Unknown,"Purchased 1925. Wrecked twice: in 1957 with a delivery truck, and in 1964 with M-100. Scrapped 1964",OpGFlpA
M-100,Edwards Rail Car Company,Motor Car,1925,Unknown,Acquired from Moorhead & North Forks Railroad; Operable. Recently repainted back to historic yellow scheme,xERnS
M-200,SS&IW,Motor Car,1927,Unknown,"Ex-TRC #22; née-LPN 20; to Niles Canyon Railway, 1975; Operable on Niles Canyon Railway",QJiEcwHn
M-300,American Car and Foundry Company,Motor Car,1935,Unknown,M-300 at Fort BraggEx-SLGW; née AR; Operable,tAzqY
