Ceremony,Award,Category,Name,Outcome
5th Vijay Awards,Vijay Award,Vijay Award for Best Supporting Actor,Sampath Raj,Nominated
5th Vijay Awards,Vijay Award,Vijay Award for Best Female Playback Singer,Andrea Jeremiah,Nominated
5th Vijay Awards,Vijay Award,Vijay Award for Best Lyricist,Gangai Amaran,Nominated
Mirchi Music Awards,Mirchi Music Award,Mirchi Listeners’ Choice – Best Song of the Year,Idhu Varai,Nominated
Mirchi Music Awards,Mirchi Music Award,Technical – Sound Mixer,Ramji & Guru for Idhu Varai,Won
Mirchi Music Awards,Mirchi Music Award,Best Upcoming Singer of the Year – Male,Ajeesh for Idhu Varai,Won
