Year,Goalkeeper,Defenders,Midfielders,Forwards
1983,"Jamie Swanner, Clemson","Mike Jeffries, DukeDavid Masur, RutgersSimon Spelling, AkronCheche Vidal, Boston","Michael Brady, AmericanAidan McClusky, Farleigh-DickinsonNeil Ridgway, BGSU","Steve McLean, Philadelphia TextileRoy Wegerle, South FloridaTom Kain, Duke"
1984,"Jeff Duback, Yale","Albert Adabe, Eastern IllinoisAdubarie Otorubio, ClemsonShaun Pendleton, Akron","Tony Bono, DrexelDale Ervine, UCLAAidan McCluskey, Farleigh-Dickinson","John Gaffney, VirginiaTom Kain, DukeMichael King, Farleigh-DickinsonSam Okpodu, NC State"
1985,"Tim Borer, Old Dominion","Paul Caligiuri, UCLAShaun Pendleton, AkronMichael Reynolds, George Mason","John Kerr Jr., DukeMark Mettrick, HartwickBruce Murray, Clemson","Michael Brady, AmericanEric Eichmann, ClemsonTom Kain, DukeSam Sumo, George Mason"
1986,"Jeff Duback, Yale","Paul Caligiuri, UCLABenjamin Okaroh, BostonSteve Trittschuh, SIUE","Mark Francis, SMUGary Furlong, MarylandJohn Harkes, Virginia","John Catliff, HarvardGuy Furfaro, PhiladelphiaGeorge Gelnovatch, VirginiaJohn Kerr Jr., Duke"
1987,"Bob Willen, Virginia","Seamus Purcell, ProvidencePaul Rutenis, ClemsonDavid Smyth, UNC","John Harkes, VirginiaMark Mettrick, HartwickTab Ramos, NC State","Doug Allison, South CarolinaBruce Murray, ClemsonKen Snow, IndianaPeter Vermes, Rutgers"
1988,"Tony Meola, Virginia","Jeff Agoos, VirginiaMarcelo Balboa, San Diego StateKevin Grimes, SMU","Henry Gutierrez, NC StatePat O'Kelly, Seton HallMark Santel, St. Louis University","Scott Benedetti, PortlandBrian Benedict, DukeKen Snow, IndianaJoey Valenti, Duke"
1989,"Tony Meola, Virginia","Kevin Grimes, SMUCam Rast, Santa ClaraKevin Wylie, Vermont","David Banks, PhiladelphiaTim Martin, Fresno StatePat O'Kelly, Seton Hall","Clark Brisson, South CarolinaPeter Isaacs, HowardRobert Paterson, EvansvilleKen Snow, Indiana"
1990,"Kasey Keller, Portland","Jeff Agoos, VirginiaScott Cannon, EvansvilleTom Loeber, South Carolina","Dario Brose, NC StateChad Deering, IndianaMark Santel, St. Louis University","Steve Rammel, RutgersKen Snow, IndianaBilly Thompson, UCLADavid Weir, Evansville"
