Courthouse,City,Street address,Jurisdiction,Dates of use,Named for
Dan M. Russell Jr. Federal Bldg & U.S. Courthouse,Gulfport,2012 15th Street,S.D. Miss.,2003-present,"District Court judge Dan Monroe Russell, Jr."
U.S. Court House,Hattiesburg,?,S.D. Miss.,1936-?Completed in 1911; now the Forrest County Courthouse Building.,n/a
William M. Colmer Federal Bldg & U.S. Courthouse,Hattiesburg,701 Main Street,S.D. Miss.,?-present,U.S. Rep. William M. Colmer
U.S. Court House & Post Office,Jackson,?,S.D. Miss.,1885-1933,n/a
James Eastland Federal Building,Jackson,?,S.D. Miss.5th Cir.,1934-present1981-present,U.S. Sen. James Eastland (1984)
U.S. Post Office & Courthouse,Meridian,8th St and 22nd Ave,S.D. Miss.,1898-1933Razed in the 1950s.,n/a
