#,Title,Time,Lead Vocals,Notes,Extra_Data_1
9.,I Love You Jesus,7:25,"Teresa Young, Stephanie Glynn,Sheila Brice",,682
10.,Washed Away,5:20,"Jeannette Johnson, Carrie Young-Davis",,821
11.,Where the Spirit Is,4:03,Jon Drummond,,147
12.,Let Me Touch You,5:26,Dalon Collins,,69
13.,Anything 4 U,5:08,"David Mann, Yolanda McDonald,Demetrice Clinkscale, Darrel Blair",,172
14.,Whatcha Lookin' 4 (remix),4:36,"Kirk Franklin, Dalon Collins, David Mann, & Tamela Mann","Drum & Synth programming - Buster & ShavoniMixed by Craig Burbridge, Buster & Shavoni, Dalon Collins, Tamela Mann, David Mann, Chris Simpson,farrell mannings",573
15.,Melodies from Heaven (skate remix),4:18,Kirk Franklin,"Drum & Synth programming - Buster & ShavoniMixed by Craig Burbridge, Buster & Shavoni",478
