Year,Category,Nominee(s),Episode,Result,Extra_Data_1,Filler_2,Random_Column_3
1991,Outstanding Editing for a Series (Multi-Camera Production),Andy Ackerman,"\The Days Of Wine And Neuroses\""""",Nominated,100,DrDPKKtB,McbH4D
1991,Outstanding Editing for a Series (Multi-Camera Production),Sheila Amos,"\Rat Girl\""""",Nominated,124,TJaMi,9KnfwLMK
1991,Outstanding Sound Mixing for a Comedy Series or a Special,"Sam Black, Robert Crosby, Jr., Robert Douglass, Thomas J. Huth","\The Days Of Wine And Neuroses\""""",Nominated,456,jGOtNyVa,SsdqUi
1992,Outstanding Individual Achievement in Editing for a Series (Multi-Camera Production),"Robert Bramwell, Peter J. Chakos","\An Old Fashioned Wedding\""""",Nominated,637,gYMfxbN,CGfnw5Qb
1992,Outstanding Individual Achievement in Sound Mixing for a Comedy Series or a Special,"Sam Black, Robert Crosby, Jr., Robert Douglass, Thomas J. Huth","\Bar Wars IV: This Time it's for Real\""""",Nominated,691,dmyNM,OfoeOPgh
1993,Outstanding Individual Achievement in Editing for a Series (Multi-Camera Production),Robert Bramwell,"\One for the Road\""""",Won,544,iHpMhU,hf0WK
