Year,Film,Function,Notes
2002,The Bacchae,Producer,"Screen adaptation of Euripides' classic play, filmed roughly two years after Mays' acclaimed Los Angeles stage production."
2004,Shakespeare's Merchant,Producer,"Adaptation of Shakespeare's The Merchant of Venice, adapted and directed by Los Angeles stage director Paul Wagar."
2004,The Trojan Women,Producer/Actress,"Documentary Film of Brad Mays' 2003 Los Angeles stage production of Euripides' classic tragedy, produced by the ARK Theatre Company."
2007,Schooled,Co-Producer,
2008,SING*ularity,Producer,"Documentary about the world-famous OperaWorks training program for classical vocalists, filmed in the years 2006 - 2007."
2008,The Watermelon,Producer,"Oddball romantic comedy, written by Michael Hemmingson. World premiere at the 2008 San Diego Film Festival. Released July 7, 2009. Received the California Film Awards 2010 Diamond Award."
