First issued,Design,Slogan,Serial format,Serials issued,Notes
1957-65 (odd years only),"Embossed white on forest green with uncolored border line; VERMONT embossed in plain block letters centered below numbers, with last two digits of registration year in similar font at bottom right","SEE embossed in same letters as VERMONT, at lower left",12345 (rounded numbers),,Alternated with white plates from 1957 to 1966
1958-66 (even years only),"Embossed forest green on white with uncolored border line; VERMONT embossed in plain block letters centered below numbers, with last two digits of registration year in similar font at bottom right","SEE embossed in same letters as VERMONT, at lower left",12345 (rounded numbers)A1234 (1962 only),,Alternated with forest green plates from 1957 to 1966
1967,"Embossed white on green with border line; VERMONT embossed in plain block letters centered below numbers, with last two digits of registration year in similar font at bottom right",None,1234A-12341234-A,,Color changed from forest green to the kelly green used today
1969,Embossed white on green with border line; VERMONT embossed in plain block letters centered below numbers; registration sticker at bottom right corner,SEE embossed in lower left corner,1234A-12341234-A,,SEE returned to plate
1972,Embossed white on green with border line; VERMONT embossed in plain block letters centered above numbers; registration sticker at bottom left corner,SEE embossed in top left corner,A-12341234-AAB-123A123B,,
