#,Date,Venue,Opponent,Score,Result,Competition
8.,30 March 2005,"Legion Field, Birmingham, United States",Guatemala,1–0,2–0,2006 FIFA World Cup qualification
9.,19 February 2006,"Pizza Hut Park, Frisco, United States",Guatemala,3–0,4–0,Friendly
10.,9 June 2007,"The Home Depot Center, Carson, United States",Trinidad and Tobago,2–0,2–0,2007 CONCACAF Gold Cup
11.,28 June 2007,"Estadio José Pachencho Romero, Maracaibo, Venezuela",Argentina,1–0,1–4,2007 Copa América
12.,15 June 2008,"The Home Depot Center, Carson, United States",Barbados,6–0,8–0,2010 FIFA World Cup qualification
13.,12 October 2012,"Sir Vivian Richards Stadium, Antigua, Antigua and Barbuda",Antigua and Barbuda,1–0,2–1,2014 FIFA World Cup qualification
