Number,Author,First line,Notes
16,William Shakespeare,"\On a day (alack the day)\""""",Dumaine's poem to Catherine in Love's Labour's Lost 4.3.99—118. Reprinted in England's Helicon (1600).
17,Unknown,\My flockes feed not," my ewes breed not\"""""
18,Unknown,"\When as thine eye hath chose the dame\""""",Three versions of the poem exist in manuscript miscellanies.
19,Christopher Marlowe & Sir Walter Raleigh,"\Live with me and be my love\""""","An inferior text of Marlowe's poem \The Passionate Shepherd to His Love\"" followed by the first stanza of Sir Walter Raleigh's \""The Nymph's Reply to the Shepherd\"""""
20,Richard Barnfield,"\As it fell upon a day\""""",First published in Poems in Divers Humors (1598).
