Rank,Name,Height,Floors,Year,Notes,Random_Column_1,Extra_Data_2
7,"Wells Fargo BuildingWells Fargo Building in Downtown Boise, Idaho",182 ft (55 m),11,1988,First Interstate until 1996,f6VSBiax,957
8,"Banner Bank BuildingBanner Bank Building in Downtown Boise, Idaho",181 ft (55 m),11,2006,,O9lAvZC,445
9,"Key TowerKey Bank Building in Downtown Boise, Idaho",174 ft (53 m),13,1963,"Bank of Idaho until 1981,First Interstate until 1988",hFyY78n,576
10,"Bronco StadiumBronco stadium in Boise, Idaho",170 ft (52 m),,1970,,ozYkQ3xl,301
11,"Hoff BuildingHoff Building in Downtown Boise, Idaho",165 ft (50 m),14,1930,,GoipYKj,625
12,"Chase Tower PlazaChase Building in Downtown Boise, Idaho",160 ft (49 m),11,1995,Washington Mutual until 2009,bp3hsJv,926
13,"Idaho Power BuildingIdaho Power Building in Downtown Boise, Idaho",160 ft (49 m),9,1990,,xvPZQjd,356
