Rank,Name,Height,Floors,Year,Notes
5,"The Grove HotelGrove Hotel in Downtown Boise, Idaho",196 ft (60 m),16,2000,
6,"The AspenAspen Loft Building in Downtown Boise, Idaho",194 ft (59 m),17,2009,
7,"Wells Fargo BuildingWells Fargo Building in Downtown Boise, Idaho",182 ft (55 m),11,1988,First Interstate until 1996
8,"Banner Bank BuildingBanner Bank Building in Downtown Boise, Idaho",181 ft (55 m),11,2006,
9,"Key TowerKey Bank Building in Downtown Boise, Idaho",174 ft (53 m),13,1963,"Bank of Idaho until 1981,First Interstate until 1988"
