Record,Date,Result,Opponent,Location,Method,Round,Random_Column_1,Filler_2,Unused_3
13-0,07/12/2013,Win,Igor Pylypenko,"Porsche Arena, Stuttgart, Germany",Unanimous Decision,6,OGq3l,clGtANjS,
12-0,27/10/2013,Win,Alphonce Mchumiatumbo,"Sarajevo, Bosnia and Herzegovina",Decision,8,7ZthaX,vqNpnS,
11-0,06/07/2013,Win,Alexander Vasiliev,"Westfalenhalle, Dortmund, Germany",TKO,2,BjMGex,QfnsPR,
10-0,02/02/2013,Win,Niko Falin,"ISS Dome, Düsseldorf, Germany",Unanimous Decision,6,lKiXo,rzMqmGt,
9-0,02/12/2012,Win,Ladislav Kovarik,"Esprit Arena, Düsseldorf, Germany",Unanimous Decision,6,AqYcdvOV,GDPVOVuA,
8-0,06/08/2012,Win,Ivica Perković,"Sarajevo, Bosnia and Herzegovina",Unanimous Decision,12,lWYYM,hEdin,
7-0,04/13/2012,Win,Aliaksandr Makaranka,"Lanxess Arena, Cologne, Germany",KO,1,FSunC,xaowsell,
