Kategori,1995,2004,2005,2006,2007
Most Favourite Supporting Actor,Didi Petet (Catatan Si Emon),Surya Saputra (Arisan),Fauzi Baadila (Tentang Dia),Tio Pakusadewo (Berbagi Suami),Winky Wiryawan (Badai Pasti Berlalu)
Most Favourite Supporting Actress,Cornelia Agatha (Lupus),Titi Kamal (Eiffel I'm In Love),Mariana Renata (Janji Joni),Ria Irawan (Berbagi Suami),Wulan Guritno (Nagabonar Jadi 2)
Best Crying Scene,Nita Tilana (Surat Untuk Bidadari),Winky Wiryawan (Mengejar Matahari),Putri Mulia (Rindu Kami Padamu),Sita Nursanti (Gie),
Most Favourite Heart Melting Moment,Onky Alexander and Paramitha Rusady (Catatan Si Boy),Vino Bastian and Maria Agnes (30 hari Mencari Cinta),,Nirina Zubir and Irwansyah (Heart),
Best Song in the Movie,Kisah Cinta Kita - James F.Sundah and Krisdayanti,Mengejar Matahari - Ari Lasso,Tentang Dia - Melly Goeslaw and Evan Sanders,My Heart - Irwansyah and Acha Septriasa,Pulang - Float[disambiguation needed]
