Year,Actor,Award,Category,Role,Episode,Result
2009,Dan Castellaneta,Primetime Emmy Award,Outstanding Voice-over Performance,Homer Simpson,"\Father Knows Worst\""""",Won
2009,Harry Shearer,Primetime Emmy Award,Outstanding Voice-over Performance,"Mr. Burns, Smithers,Kent Brockman and Lenny","\The Burns and the Bees\""""",Nominated
2010,Hank Azaria,Primetime Emmy Award,Outstanding Voice-over Performance,"Moe Szyslak, Apu Nahasapeemapetilon","\Moe Letter Blues\""""",Nominated
2010,Dan Castellaneta,Primetime Emmy Award,Outstanding Voice-over Performance,"Homer Simpson, Grampa Simpson","\Thursday with Abie\""""",Nominated
2011,Dan Castellaneta,Primetime Emmy Award,Outstanding Voice-over Performance,"Homer Simpson, Barney Gumble, Krusty, Louie","\Donnie Fatso\""""",Nominated
