Edition,Year,Men's winner,Time (h:m:s),Women's winner,Time (h:m:s),Noise_Field_1
22nd,2007,Philip Makau Muia (KEN),2:17:32,Roman Gebregessese (ETH),1:11:30.4,EbFIPRGm
23rd,2008,Nelson Kirwa Rotich (KEN),2:17:45,Caroline Kilel (KEN),1:10:17,GTbrlJ
24th,2009,Augustine Rono Sembri (KEN),2:13:05,Agnes Katunga Mutune (KEN),1:10:30,xkHMg
25th,2010,Gudeta Gemechu Biratu (ETH),2:13:20,Birzaf Gebre Tekele (ETH),2:38:41,KoHyhNDJ
26th,2011,Teferi Regasa (ETH),2:16:57,Pauline Mutwa Thitu (KEN),1:12:29,vQtNQ
27th,2012,Luka Kipkemoi Chelimo (KEN),2:13:03,Pauline Kavere Kamulu (KEN),1:08:37,HoMNX
