Rank,Film,Year,Opening Weekend(three day),Inflation-adjusted(2014 USD),Dummy_Col_1,Filler_2,Noise_Field_3
21,Transformers: Revenge of the Fallen,2009,"$108,966,307","$119,783,499",oUMTdlN,oVRhg,uRIDQyyn
22,Star Wars Episode III: Revenge of the Sith,2005,"$108,435,841","$130,939,650",sKxWoLwr,SdHaYLCz,LClmAuJn
23,Shrek 2,2004,"$108,037,878","$134,895,074",LOKMh,nMcOQXg,EnaJvK
24,X-Men: The Last Stand,2006,"$102,750,665","$120,203,691",ctGZutW,yDmjFPOa,ZjYOpdqT
25,Harry Potter and the Goblet of Fire,2005,"$102,685,961","$123,996,491",FFCtXbw,CLPEfbNY,wYOtojCr
26,Indiana Jones and the Kingdom of the Crystal Skull,2008,"$100,137,835","$109,687,301",LzQXD,UubhlIYl,HuwpSx
