Week of,Tournament,Champions,Runners-up,Semifinalists,Quarterfinalists
7 November,"Topper South American OpenBuenos Aires, ArgentinaATP World Series$288,750",Àlex Corretja6–3 5–7 7–6(5),Javier Frana,Francisco Clavet Karel Nováček,Alberto Berasategui Luiz Mattar Slava Doseděl Juan Albert Viloca
7 November,"Topper South American OpenBuenos Aires, ArgentinaATP World Series$288,750",Sergio Casal Emilio Sánchez6–3 6–2,Tomás Carbonell Francisco Roig,Francisco Clavet Karel Nováček,Alberto Berasategui Luiz Mattar Slava Doseděl Juan Albert Viloca
7 November,"Kremlin CupMoscow, RussiaATP World Series$1,100,000",Alexander Volkov6–2 6–4,Chuck Adams,Jacco Eltingh Marc Rosset,Petr Korda Daniel Vacek Yevgeny Kafelnikov Carl-Uwe Steeb
7 November,"Kremlin CupMoscow, RussiaATP World Series$1,100,000",Jacco Eltingh Paul HaarhuisW/O,David Adams Andrei Olhovskiy,Jacco Eltingh Marc Rosset,Petr Korda Daniel Vacek Yevgeny Kafelnikov Carl-Uwe Steeb
7 November,"European Community ChampionshipsAntwerp, BelgiumATP World Series$1,100,000",Pete Sampras7–6(5) 6–4,Magnus Larsson,Jared Palmer Olivier Delaître,Byron Black Patrick Rafter Jonas Björkman Sébastien Lareau
