Name,Location,Opened,Gender,Security level(s),Capacity
Northland Region Corrections Facility,"near Kaikohe, Northland",2005,Male,Minimum to High,548
Auckland Prison,"Paremoremo, Auckland",1968,Male,Minimum to Maximum,681
Mount Eden Corrections Facility,"Mount Eden, Auckland",2011,Male,Remand,966
Auckland Region Women's Corrections Facility,"Wiri, Auckland",2006,Female,Minimum to Maximum,456
Spring Hill Corrections Facility,"Hampton Downs, Waikato",2007,Male,Minimum to High,1050
Waikeria Prison,"south of Te Awamutu, Waikato",1911,Male,Minimum to High,750
