Name,Location,Opened,Gender,Security level(s),Capacity,Noise_Field_1,Noise_Field_2,Unused_3
Northland Region Corrections Facility,"near Kaikohe, Northland",2005,Male,Minimum to High,548,HixWqfQ,yePcP,
Auckland Prison,"Paremoremo, Auckland",1968,Male,Minimum to Maximum,681,WQNNVlY,LqDDnX,
Mount Eden Corrections Facility,"Mount Eden, Auckland",2011,Male,Remand,966,hkYAKoy,GvezDROM,
Auckland Region Women's Corrections Facility,"Wiri, Auckland",2006,Female,Minimum to Maximum,456,luqjuMW,LGHDz,
Spring Hill Corrections Facility,"Hampton Downs, Waikato",2007,Male,Minimum to High,1050,kQxdjL,sDgnIoVs,
Waikeria Prison,"south of Te Awamutu, Waikato",1911,Male,Minimum to High,750,UUGXa,tvhcl,
Tongariro/Rangipo Prison,"near Turangi, Waikato",1922,Male,Minimum to Low-medium,540,ajUIBO,KsNZGFLH,
Whanganui Prison,"Kaitoke, south of Wanganui",1978,Male,Minimum to High,538,RhxSI,YhVakdgZ,
Hawke's Bay Regional Prison,south of Hastings,1989,Male,Minimum to High,666,MYzhZK,TMgmIuIj,
