Title,Year,Publisher,Developer,Platforms,Random_Column_1,Noise_Field_2,Filler_3
The Lord of the Rings: War in the North,2011,Warner Bros. Interactive Entertainment,Snowblind Studios,"PlayStation 3, MS Windows, Xbox 360",Cow4s,uqvQGdD,NocuyKTq
The Lord of the Rings Online: Rise of Isengard,2011,Warner Bros. Interactive Entertainment,"Turbine, Inc.",MS Windows,iXI7Z,dKBDHjQ,rVXwcol
The Lord of the Rings Online: Riders of Rohan,2012,Warner Bros. Interactive Entertainment,"Turbine, Inc.",MS Windows,3uZvqDE,gInoapg,yfiJQNJR
Guardians of Middle-earth,2012,Warner Bros. Interactive Entertainment,Monolith Productions,"Xbox 360, PlayStation 3, MS Windows",4Rqs50bg,RSmhB,zfOyT
Lego The Lord of the Rings,2012,Warner Bros. Interactive Entertainment,Traveler's Tales,"MS Windows, Wii, Nintendo 3DS, PlayStation Vita, PlayStation 3, Nintendo DS, Xbox 360",VsHP92lh,EjzQVzG,KZMnISX
The Hobbit: Kingdoms of Middle-earth,2012,,Kabam,"Android, Apple iOS",9igVOWpa,RRSHQN,lLXjHcnC
The Hobbit: Armies of the Third Age,2013,,Kabam,Browser game,wWBkZT,sZgLQYwk,tKxfe
The Lord of the Rings Online: Helm's Deep,2013,Warner Bros. Interactive Entertainment,"Turbine, Inc.","Mac OS X, MS Windows",LOTkwVu,CQJNpUp,paAbasJ
Middle-earth: Shadow of Mordor,2014,Warner Bros. Interactive Entertainment,Monolith Productions,"Xbox 360, Xbox One, PlayStation 3, PlayStation 4, MS Windows",4xowAcJU,HpPUHV,wMduiW
