Title,Genre,Sub­divisions,Libretto,Première date,"Place, theatre"
Die Spottvogelwirtin,,3 acts,Rudolf Oesterreicher,1906,Vienna
Ein tolles Mädel (English: Mlle Mischief),Vaudeville-Operette,Prologue and 2 acts,Wilhelm Sterk (after: Kurt Kraatz and Heinrich Stobitzer) (English: Sydney Rosenfeld),"24 August 1907, English version: 28 September 1908","Wiesbaden; English version: New York City, Lyric Theatre;"
Am Lido,Operette,1 act,Ottokar Tann-Bergler and Alfred Deutsch-German,31 August 1907,"Vienna, Kolosseum"
Der Liebeswalzer,Operette,3 acts,Robert Bodanzky and Fritz Grünbaum,24 October 1908,"Vienna, Raimund Theater"
Herr und Frau Biedermeier,Singspiel,1 act,Wilhelm Sterk,9 January 1909,"Munich, 'Kleine Bühne'"
Die Gaukler,Operette,1 act,Emil Golz and Arnold Golz,6 September 1909,"Vienna, Apollotheater"
Ball bei Hof,Operette,3 acts,"Wilhelm Sterk (after the comedy \Hofgunst\"" by Thilo von Trotha)""",22 January 1911,"Stettin, Stadttheater"
"In fünfzig Jahren — \Zukunftstraum einer Küchenfee\""""",Burleske-Operette,2 acts,Leopold Krenn and Carl Lindau,13 January 1911,"Vienna, Ronacher"
