Year,Award,Category,Nominated work,Result
1979,Olivier Award,Best Actress in a Revival,Once in a Lifetime,Won
1981,Tony Award,Best Featured in a Play,Piaf!,Nominated
1981,Drama Desk Award,Outstanding Featured Actress in a Play,Piaf!,Nominated
1984,Olivier Award,Best Actress in a Revival,Twelfth Night,Nominated
1984,Olivier Award,Best Actress in a Supporting Role,The Time of Your Life,Nominated
1985,Olivier Award,Best Performance in a Supporting Role,Mother Courage,Nominated
1986,Tony Award,Best Featured Actress in a Play,Loot,Nominated
