#,Date,Venue,Opponent,Score,Result,Competition
38,29 May 2010,"Stadium Puskás Ferenc, Budapest, Hungary",Hungary,1–0,3–0,Friendly
39,13 June 2010,"Moses Mabhida Stadium, Durban, South Africa",Australia,1–0,4–0,FIFA World Cup 2010
40,27 June 2010,"Free State Stadium, Bloemfontein, South Africa",England,2–0,4–1,FIFA World Cup 2010
41,7 September 2010,"RheinEnergieStadion, Cologne, Germany",Azerbaijan,2–0,6–1,UEFA Euro 2012 qualifying
42,12 October 2010,"Astana Arena, Astana, Kazakhstan",Kazakhstan,3–0,3–0,UEFA Euro 2012 qualifying
43,2 September 2011,"Veltins-Arena, Gelsenkirchen, Germany",Austria,3–0,6–2,UEFA Euro 2012 qualifying
44,17 June 2012,"Arena Lviv, Lviv, Ukraine",Denmark,1–0,2–1,UEFA Euro 2012
45,29 May 2013,"FAU Stadium, Miami, USA",Ecuador,1–0,4–2,Friendly
46,29 May 2013,"FAU Stadium, Miami, USA",Ecuador,3–0,4–2,Friendly
