#,Date,Venue,Opponent,Score,Result,Competition
20,6 September 2006,"Stadio Olimpico, Serravalle, San Marino",San Marino,10–0,13–0,UEFA Euro 2008 qualifying
21,11 October 2006,"Tehelné Pole Stadion, Bratislava, Slovakia",Slovakia,1–0,4–1,UEFA Euro 2008 qualifying
22,11 October 2006,"Tehelné Pole Stadion, Bratislava, Slovakia",Slovakia,4–1,4–1,UEFA Euro 2008 qualifying
23,12 September 2007,"Rhein-Energie Stadion, Cologne, Germany",Romania,3–1,3–1,Friendly
24,17 November 2007,"AWD Arena, Hanover, Germany",Cyprus,3–0,4–0,UEFA Euro 2008 qualifying
25,26 March 2008,"St. Jakob Park, Basel, Switzerland",Switzerland,4–0,4–0,Friendly
26,8 June 2008,"Wörthersee Stadion, Klagenfurt, Austria",Poland,1–0,2–0,UEFA Euro 2008
27,8 June 2008,"Wörthersee Stadion, Klagenfurt, Austria",Poland,2–0,2–0,UEFA Euro 2008
28,12 June 2008,"Wörthersee Stadion, Klagenfurt, Austria",Croatia,1–2,1–2,UEFA Euro 2008
