,Poetry Prize,Poetry Accessit(s),Honourable Mention(s),Prose Prize,Prose Accessit(s),Honourable Mention(s),Extra_Data_1,Random_Column_2
10th Edition (2005),María Teresa Núñez González,Amadeo Cobas ; Unai González Suárez,,Francisco Piñeiro González,Julio Romero Suárez María ; Teresa López de la Fuente ; Domingo A. Martínez Martín,,596,BbI4j
11th Edition (2006),Restituto Núñez Cobos,Juan Lorenzo Collado Gómez ; Alba Cid Fernández ; Isabel Oliver González,,Francisco Rozados Rivas,Juan Lorenzo Collado Gómez ; Francisco Piñeiro González,,470,ddfVYoE
12th Edition (2007),Carmen Caramés Gorgal,Alfredo Macías Macías ; Manuel Luque Tapia,,Rafael Laso Lorenzo,Francisco Piñeiro González ; Iván García Campos,,448,DH77MSFq
13th Edition (2008),Feliciano Ramos Navarro,José M. López Calo ; Cristalina López Rodríguez,,Moisés Alvarez Jorge,Carmen Cuevas Crespo ; Julio Romero Suárez,,619,djQ3t
14th Edition (2009),Alba Cid Fernández,Sara Castelar Lorca ; Mª Isabel Gómez Arto,,Alberto Rodríguez Díaz,Juan José Ruíz Moñino ; Isabel Julián Quiroga,,906,9DPUc
15th Edition (2010),Emma Pedreira,Manuel García Díaz Pintado ; Rosa Piñeiro Fariña,,Pepe Pol,Noa María Carballa Rivas ; Mercedes Blanco Iglesias,,638,TRZWu
16th Edition (2011),Beatriz Lorenzo,José María Calo ; Pablo Núñez González ; Marcial González Vigo,,Xosé Manuel Dopazo Mella,Noa María Carballa Rivas ; Mercedes Blanco Iglesias,,920,4cCUgzsx
17th Edition (2012),José Antonio Repeto González,Xosé Otero Canto ; Marcial González Vigo,Margarita Souvirón López ; Yoli López,Erick Hernández Mora,Pepe Pol ; Xaime Domínguez Toxo,Sofía Rodríguez Suárez ; Marcos Dios Almeida,289,jYVcUl
18th Edition (2013),Ramón Sandoval Pérez,Luis García Pérez ; Jacobo Llamas Martínez,Xosé Otero Canto ; Mercedes Saénz Blasco ; José Gabriel Rodríguez Ambrosio,Manrique Fernández Vázquez,Xosé Farruco Graña Rama ; José Luis Hernández Garvi,José Ángel Corral Suárez ; Antonio Garrigo Jiménez,102,aLd1FIla
