Country,URL,Opening date,Closing date,Country,URL,Opening date,Closing date
Argentina (links to Habbo Spain),habbo.es,—,—,Bolivia (links to Habbo Spain),habbo.es,—,—
Australia (links to Habbo English due to the Merge),habbo.com.au,November 2004,"June 2, 2010",Malaysia (links to Habbo English),habbo.com.my,July 2006,—
Austria (links to Habbo Switzerland),habbo.at,May 2006,—,Mexico (links to Habbo Spain),habbo.com.mx,July 2006,—
Belgium (links to Habbo Netherlands),habbo.be,May 2006,—,Netherlands,habbo.nl,February 2004,—
Brazil,habbo.com.brhabbo.com,February 2006April 2012,——,New Zealand (links to Habbo English),habbo.co.nz,August 2006,—
Canada (links to Habbo English due to the Merge),habbo.ca,June 2004,"May 5, 2010",Norway,habbo.no,June 2004,—
