Name,Birth,Marriages,Death
James I1231–1276,2 February 1208Montpellierson of Peter II of Aragon and Marie of Montpellier,Eleanor12211 childViolant of Hungary123510 childrenTeresa Gil de Vidaure2 children,27 July 1276Valenciaaged 68
James II1276–1286(first rule),1243Montpellierson of James I of Aragon and Violant of Hungary,Esclaramunda of Foix12756 children,1311Palma de Mallorcaaged 68
Alfonso I1286–1291,1265Valenciason of Peter III of Aragon and Constance of Sicily,unmarried,18 June 1291Barcelonaaged 27
James III1291–1295,10 August 1267Valenciason of Peter III and Constance of Sicily,Isabella of Castile1 December 1291No childrenBlanche of Anjou29 October 129510 childrenMarie de Lusignan15 June 1315No childrenElisenda de Montcada25 December 1322No children,5 November 1327Barcelonaaged 60
James II1295–1311(second rule),1243Montpellierson of James I of Aragon and Violant of Hungary,Esclaramunda of Foix12756 children,1311Palma de Mallorcaaged 68
Sancho1311–1324,1276son of James II of Majorca and Esclaramunda of Foix,Maria of Naples20 September 1304No children,4 September 1324Formigueraaged 48
James III of Majorca1324–1344,5 April 1315Cataniason of Ferdinand of Majorca and Isabelle of Sabran,Constance of Aragon2 childrenViolant of Vilaragut10 November 13471 child,25 October 1349Llucmajoraged 34
