Rank,Title,Studio,Actor/Actress,Director,Gross,Irrelevant_1,Extra_Data_2,Random_Column_3
11.,The Witches of Eastwick,Warner Bros.,"Jack Nicholson, Cher, Susan Sarandon, Michelle Pfeiffer",George Miller,"$63,766,510",Gqitu,989,GTFax
12.,Predator,Fox,"Arnold Schwarzenegger, Carl Weathers, Jesse Ventura, Bill Duke, Shane Black, and Kevin Peter Hall",John McTiernan,"$59,735,548",RTeXDcD,30,Veh5hOuN
13.,Throw Momma from the Train,Orion,"Danny DeVito, Billy Crystal, Kate Mulgrew, and Anne Ramsey",Danny DeVito,"$57,915,972",A4NmFH78,210,krYf2I
14.,Dragnet,Universal,"Dan Aykroyd, Tom Hanks, Alexandra Paul, Christopher Plummer, and Dabney Coleman",Tom Mankiewicz,"$57,387,516",S74zRt,680,Kwj4F4m
15.,RoboCop,Orion,"Peter Weller, Nancy Allen, Ronny Cox, Kurtwood Smith, Miguel Ferrer, and Dan O'Herlihy",Paul Verhoeven,"$53,424,681",m7I9H,865,zXlXCPv
