Wrestler:,Times:,Date:,Location:,Notes:
Larry Zbyszko,1*,,,Title returned to Zbyszko.
Ricky Landell,1,"October 11, 2008","Indianapolis, Indiana",Title becomes known as the WSL World Heavyweight Championship when the promotion is forced to rename.
Keith Walker,1,"February 21, 2009","Michigan City, Indiana",
Jonnie Stewart,2,"June 9, 2012","Landover, Maryland","In a day referred to as The Saturday Night Massacre, in reference to President Nixon's firing of two Whitehouse attorneys general in one night; President Dale Gagne strips and fires Keith Walker when Walker refuses to defend the title against Ricky Landell, in an event in Landover, Maryland. When Landell is awarded the title, he refuses to accept and is too promptly fired by Gagne, who than awards the title to Jonnie Stewart."
The Honky Tonk Man,1,"August 18, 2012","Rockford, Illinois","The morning of the event, Jonnie Stewart's doctors declare him PUP (physically unable to perform) and WSL officials agree to let Mike Bally sub for Stewart."
