,Episode title,Romanized title,Translation of title,Broadcast date,Ratings
Ep. 7,あの子を返して!,Ano ko o kaeshite!,Return her to me!,26 May 2010 16 September 2011 19 September 2011,12.4%
Ep. 8,断ち切れない絆,Tachikirenai kizuna,The bond that can’t be broken,2 June 2010 23 September 2011 26 September 2011,14.0%
Ep. 9,引き裂かれる二人,Hikisaka reru ni-nin,The two torn apart,9 June 2010 30 September 2011 3 October 2011,12.2%
Ep. 10,ひと目会いたい,Hitome aitai,I want to see you just once,16 June 2010 7 October 2011 10 October 2011,14.8%
Ep. 11,ずっと愛してる,Zutto aishi teru,I will always love you,23 June 2010 14 October 2011 17 October 2011,16.3%
