Name,Abbr.,Leader,Ideology,Political position,MPs,Filler_1,Random_Column_2,Extra_Data_3
Serbian Progressive PartyСрпска напредна странка / Srpska napredna stranka,SNS,Aleksandar Vučić,Conservatism,Centre-right,134 / 250,OyHcRHeo,jus7iEa,878
Socialist Party of SerbiaСоцијалистичка партија Србије / Socjalistička patrija Srbje,SPS,Ivica Dačić,Socialism,Centre-left to Left-wing,25 / 250,WLbyoFy,JW7EtPGk,546
Democratic PartyДемократска странка / Demokratska stranka,DS,Dragan Đilas,"Social democracy, Third Way",Centre-left to Centre,17 / 250,JsRoR,XsxxL,485
Party of United Pensioners of SerbiaПартија уједињених пензионера Србије/ Partija ujedinjenih penzionera Srbije,PUPS,Jovan Krkobabić,Pensioners' interests,Left-wing,12 / 250,XoQSCetX,xjDLfQ,887
New Democratic PartyНова демократска странка / Nova demokratska stranka,NDS,Boris Tadić,"Social democracy, Green politics",Centre-left,10 / 250,yVvOjqHi,avysy,188
Social Democratic Party of SerbiaСоцијалдемократска партија Србије/ Socijaldemokratska partija Srbije,SDPS,Rasim Ljajić,Social democracy,Centre-left,10 / 250,LiSNkL,Ltg5F,293
United SerbiaЈединствена Србија/ Jedinstvena Srbija,JS,Dragan Marković,Populism,Right-wing,7 / 250,CpLCqQv,aRSqgh,716
League of Social Democrats of VojvodinaЛига социјалдемократа Војводине/ Liga socijaldemokrata Vojvodine,LSV,Nenad Čanak,"Social democracy, Regionalism",Centre-left,6 / 250,rMMNZ,euW1l7,236
