Name,Abbr.,Leader,Ideology,Political position,MPs
New SerbiaНова Србија/ Nova Srbija,NS,Velimir Ilić,Populism,Centre-right,6 / 250
Alliance of Vojvodina HungariansСавез војвођанских Мађара / Savez vojvođanskih Mađara,SVM,István Pásztor,Hungarian minority politics,Minority politics,6 / 250
Serbian Renewal MovementСрпски покрет обнове/ Srpski pokret obnove,SPO,Vuk Drašković,"Monarchism, Pro-Europeanism",Centre-right,5 / 250
Movement of SocialistsПокрет социјалиста/ Pokret socijalista,PS,Aleksandar Vulin,"Socialism, Marxism",Left-wing to Far-left,3 / 250
Party of Democratic Action of SandžakСтранка Демократске Акције Санџака / Stranka Demokratske Akcije Sandžaka,SDA,Sulejman Ugljanin,Bosniak minority politics,Minority politics,3 / 250
Together for SerbiaЗаједно за Србију / Zajedno za Srbiju,ZZS,Dušan Petrović,Social democracy,Centre-left,2 / 250
New PartyНова странка / Nova stranka,NOVA,Zoran Živković,"Liberalism, Pro-Europeanism",Centre,2 / 250
Party for Democratic ActionПартија за демократско деловање / Partija za demokratsko delovanje,PDD,Riza Halimi,Albanian minority politics,Minority politics,2 / 250
