Date,Sub,Flight,Dead,Hurt,Pax.,Type,Perpetrator,Description
14 June 1985,—,Trans World Airlines — 847ATH → BEY → ALG → BEY → ALG → BEY,1,5,147,Hijacking -- Hostage taking(3 days),Hezbollah & Islamic Jihad,"—Hijacking in Greek airspace & hostages freed in Beirut, LebanonA Trans World Airlines Boeing 727 is hijacked by two Lebanese men, who had smuggled pistols and grenades through the Athens airport security, after originally taking off from Cairo. The flight was en route from Athens to Rome and then scheduled to terminate in London. The hijackers were seeking the release of 700 Shi'ite Muslims from Israeli custody.Some passengers were threatened and some beaten. United States Navy diver Robert Dean Stethem was killed, and his body was thrown onto the tarmac. Dozens of passengers were held hostage over the next two weeks until released by their captors after some of their demands were met."
23 November 1985,—,Egypt Air — 648ATH → MLA,58,20+,95,Hijacking -- Hostage taking(2 days),Abu Nidal Organisation,"—Hijacking in Greek airspace & raid to free hostages at Malta International Airport, MaltaThe Boeing 737-266 took off at 20:00 (UTC+2) on an Athens-to-Cairo route. Ten minutes after takeoff, three Palestinian gunmen hijacked the aircraft. The terrorists, calling themselves the Egypt Revolution, were armed with guns and grenades. During the initial hijacking an Egyptian Security Service agent opened fire, killing one terrorist instantly before being wounded along with two flight attendants. In the exchange of fire the fuselage was punctured, causing a rapid depressurization. The aircraft was forced to descend to 14,000 feet (4,300 m) to allow the crew and passengers to breathe. The ailing plane was diverted to land in Malta.The chief hijacker threatened to kill a passenger every 15 minutes until his demands were met. An Israeli woman, Nitzan Mendelson and an American, Scarlett Marie Rogenkamp, were executed.On 25 November, the storming of the aircraft by the Egyptian Al-Sa'iqa (Thunderbolt) unit — Task Force 777 — killed 54 out of the remaining 87 passengers, two crew members and one hijacker. A total of 58 out of the 95 passengers and crew had died and 2 out of the 3 hijackers by the time the crisis was over. Maltese medical examiners estimated that 4 passengers were shot to death by the commandos."
2 April 1986,,Trans World Airlines — 840FCO → ATH,4,7,122,Improvised Explosive Device,Abu Nidal Organisation,"—Greek airspaceAbout 20 minutes before landing, a bomb hidden underneath seat 10-F is detonated on the Boeing 727-231 -- flying en route from Rome to Athens -- while it was over Argos, Greece, blasting a hole in the plane's starboard side. Four American passengers, including a nine-month-old infant, are ejected through the hole to their deaths below. Seven others on the aircraft were injured by shrapnel as the cabin suffered a rapid decompression. The remaining 110 passengers survived the incident as pilot Richard \Pete\"" Petersen made an emergency landing."""
19 September 1989,,Union de Transport Aériens— 772BZV → NDJ → CDG,170,-,170,Improvised explosive device,Libyanagents,"—Niger airspaceA McDonnell Douglas DC-10 aircraft operated by the French airline Union des Transports Aériens took off from N'Djamena International Airport at 13:13. Forty-six minutes later, at its cruising altitude of 10,700 metres (35,100 ft), a bomb explosion caused UTA Flight 772 to break up over the Sahara Desert 450km east of Agadez in the southern Ténéré of Niger. All 155 passengers and 15 crew members died."
24 December 1994,,Air France — 8969ALG → MRS,3,16,232,Hijacking,GIA(Islamists),"—Hijacking in Algiers & raid to free hostages at Marseille Provence Airport, France.An Air France Airbus A300B2-1C is hijacked by the Armed Islamic Group at Houari Boumedienne Airport, Algiers, Algeria, with the intention of blowing up the plane over the Eiffel Tower in Paris. Three passengers are killed. When the aircraft reaches Marseille, the GIGN, an intervention group of the French National Gendarmerie, storms the plane and kills all four hijackers. Thirteen passengers, three crew and nine GIGN members are injured."
