Event,Date,Area,Tornadoes,Casualties,Notes
May 1968 tornado outbreak,"May 15–16, 1968",Mississippi Valley,46,74 fatalities,"Two F5 tornadoes struck Iowa on the same day, killing 18 people. Two deadly F4s struck Arkansas, including one that killed 35 people in Jonesboro."
1968 Tracy tornado,"June 13, 1968",Minnesota,1,9 fatalities,"Powerful but narrow F5 tornado killed nine people and injured 150 in Tracy, Minnesota."
"1969 Hazlehurst, Mississippi tornado outbreak","January 23, 1969",Southeastern United States,3,32 fatalities,"Devastating pre-dawn tornado near Hazlehurst killed 32 people on a long path across southern Mississippi. (2 significant, 1 violent killer)"
1969 Minnesota tornado outbreak,"August 6, 1969",Minnesota,13,"15 fatalities, 109 injuries",Mid-summer outbreak produced several destructive tornadoes in Minnesota. An F4 tornado killed 12 people near Outing.
August 1969 Cincinnati tornado outbreak,"August 9, 1969",Indiana – Ohio,10,4 fatalities,F4 killed 4 in the Cincinnati suburbs. Other strong tornadoes occurred in Indiana and Virginia.
