Event,Date,Area,Tornadoes,Casualties,Notes
May 1960 tornado outbreak sequence,"May 4–6, 1960","Southern Great Plains, South, Midwest",66,33 fatalities,"Produced numerous violent and killer tornadoes, especially in Oklahoma. An F5 killed five people and produced extreme damage near Prague and Iron Post. An F4 struck Wilburton and killed 16. (41 significant, 5 violent, 8 killer)"
Hurricane Carla,September 1961,Southern U.S.,8,–,"Produced several strong tornadoes, including an F4 killer tornado that hit Galveston, Texas."
1964 Wichita Falls Tornado,"April 3, 1964","Wichita Falls, Texas",–,"7 dead, 100+ injured","Was rated F5. First tornado ever captured on live television. First of two violent tornadoes to hit Wichita Falls, the other—an F4 that killed 42—occurring on April 10, 1979."
1964 Michigan tornado,"May 8, 1964",Metro Detroit,1,11 fatalities,F4 tornado struck suburban areas of metropolitan Detroit.
February 1965 South Florida tornado outbreak,"February 23, 1965",Southern Florida,4,"0 fatalities, 8 injuries","Produced an unusually strong tornado in South Florida, an F3 that hit Fort Lauderdale. (2 significant, 0 violent, 0 killer)"
1965 Palm Sunday tornado outbreak,"April 11–12, 1965",Central United States,47,256–271 fatalities,"Among the most intense outbreaks ever recorded. Numerous violent and long-track tornadoes, some possibly F5s, tore across the Great Lakes states, killing hundreds of people. Two violent F4s hit Dunlap, Indiana, killing 51 people there. Two F4s with parallel paths in Michigan killed 44 people. Deadly tornadoes also impacted the Cleveland and Toledo areas. (32 significant, 17 violent, 21 killer)"
