Responsible Minister(s),Crown Entities,Monitoring Department(s),Category / Type,Empowering Legislation
Foreign Affairs,New Zealand Antarctic Institute,Foreign Affairs and Trade,Crown agent,New Zealand Antarctic Institute Act 1996 (Part 1 and Schedule 1)
Health,Alcohol Advisory Council of New Zealand,Health,ACE,Alcohol Advisory Council Act 1976
Health,Crown Health Financing Agency,Health,Crown agent,New Zealand Public Health and Disability Act 2000 (Part 4 and Schedule 6)
Health,District health boards (21),Health,Crown agent,New Zealand Public Health and Disability Act 2000 (Part 3 and Scheds 2 and 3)
Health,Health and Disability Commissioner,Health,ICE,Health and Disability Commissioner Act 1994 (Part 1 and Schedule 2)
Health,Health Research Council of New Zealand,Health,Crown agent,Health Research Council Act 1990 (Part 1 and Schedule 1)
Health,Health Sponsorship Council,Health,Crown agent,Smoke-free Environments Act 1990 (Part 3)
Health,Mental Health Commission,Health,ACE,Mental Health Commission Act 1998 (Schedule 1)
Health,New Zealand Blood Service,Health,Crown agent,New Zealand Public Health and Disability Act 2000 (Part 4 and Schedule 6)
Health,Pharmaceutical Management Agency,Health,Crown agent,New Zealand Public Health and Disability Act 2000 (Part 4 and Schedule 6)
