Name,Audition taken in,Gang,Notes
Paulami De,Kolkata,Om Blues,Voted out in the 12th episode.
Samrat Kaushal,Ahmedabad,Om Blues,"Won A Hero Honda Karizma, Voted out in the 9th episode."
Tamanna Sharma (Tammy),Chandigarh,Om Blues,"GOT A Hero Honda Karizma from Suraj aka Nagesh(Roadies Season 8.0), Voted out in the 8th episode."
Sandeep Singh (Sandy),New Delhi,Brats,Voted out in the 7th episode.
Bobby Chopra,New Delhi,Brats,Evicted in the 7th episode by challenge from Palak in Mechanical Bull task.
