Year,Film Title,Duration,Film Type,Shoot Location,Extra_Data_1,Noise_Field_2,Filler_3
1979,Mein Fenster (My Window),2:26,35 mm short film,Vienna,875,yZtAZ,RnrFhlV
1980,Tango,8:14,35 mm short film,"SMFF Se-Ma-For Łódź, Poland",109,EjlZsX,Agzvv
1980,Media,1:36,35 mm short film,"SMFF Se-Ma-For Łódź, Poland",930,BJBSMU,nqRHoYQ
1980,Sceny Narciarskie z Franzem Klammeren (Ski Scenes with Franz Klammer),9:38,35 mm documentary film,"in collaboration with B. Dziworski, WFO Łódź, Poland and Signal Film, Vienna",8,QyJSr,kVKla
1981,Wdech-Wydech (Inhale-Exhale),2:26,35 mm short film,"in collaboration with B. Dziworski, SMFF Se-Ma-For Łódź, for TVP, Poland",799,Tlrquq,ApiZFe
