Mine,Province,Coordinates,Town,Dates,Comments
Kanichee Mine*,Ontario,47°06′13.07″N 79°50′38.63″W﻿ / ﻿47.1036306°N 79.8440639°W,Temagami,"1937-1948, 1948-1949, 1973-1976","Secondary products included gold, palladium, silver and platinum."
Leckie Mine,Ontario,47°05′36.34″N 79°47′48.68″W﻿ / ﻿47.0934278°N 79.7968556°W,Temagami,"~1900-1909, 1933-1937","Also produced arsenic, copper and silver"
McIntyre Mines,Ontario,,,,
Norrie Mine*,Ontario,47°06′59.59″N 79°46′27.63″W﻿ / ﻿47.1165528°N 79.7743417°W,Temagami,Prior to 1920,"Secondary products included lead, gold, zinc and silver."
Northland Pyrite Mine*,Ontario,47°10′26.24″N 79°44′34.45″W﻿ / ﻿47.1739556°N 79.7429028°W,Temagami,1906-1911,"Secondary products included cobalt, copper, zinc, gold and nickel."
Red Lake Mine,Ontario,,Red Lake,,
Temagami-Lorrain Mine,Ontario,47°06′39.79″N 79°40′58.2″W﻿ / ﻿47.1110528°N 79.682833°W,Temagami,Prior to 1912,"Also produced cobalt, arsenic, silver, nickel and copper"
