Year,Title,Catalog,Year,Title,Catalog
1941,Poor You / Last Call For Love,Decca 18320,1949,"Put Your Arms Around Me, Honey / Meet Me Tonight in Dreamland",MGM 50025
1942,For Me and My Gal / When You Wore a Tulip (w. Gene Kelly),Decca 18480,1949,Play That Barbershop Chord / I Don't Care,MGM 50026
1942,I Never Knew / On the Sunny Side of the Street,Decca 18524,1950,"Happy Harvest / If You Feel Like Singing, Sing",MGM 30252
1942,That Old Black Magic / Poor Little Rich Girl,Decca 18540,1950,Friendly Star / Get Happy,MGM 30254
1943,Could You Use Me? ( w. Mickey Rooney) / Embraceable You,Decca 23303,1953,Send My Baby Back to Me / Without a Memory,Columbia 40010
1943,But Not For Me,Decca 23309,1953,"Go Home, Joe / Heartbroken",Columbia 40023
1944,Over the Rainbow / I May Be Wrong (But I Think You're Wonderful) (w. Tommy Dorsey's Orchestra),V-Disc 335-A,1954,The Man That Got Away / Here's What I'm Here For,Columbia 40270
1943,Bidin' My Time / I've Got Rhythm,Decca 23310,1956/1955,Maybe I'll Come Back / Over the Rainbow,Capitol 6128
1943,"No Love, No Nothin' / A Journey to a Star",Decca 18484,1957,It's Lovely to Be Back Again in London / By Myself,EMI CL-14791 (British release)
