Year,Title,Catalog,Year,Title,Catalog
1939,In Between / Sweet Sixteen,Decca 15045,1947,Who?,MGM 30003
1939,Oceans Apart / Figaro,Decca 2873,1947/1949,Look for the Silver Lining / Merry Christmas,MGM 30212
1940,Friendship (w. Johnny Mercer) / The Wearing of the Green,Decca 3165,1948,Be a Clown,MGM 30097
1940,Buds Won't Bud / I'm Nobody's Baby,Decca 3174,1948,Love of My Life / You Can Do No Wrong,MGM 30098
1940,The End of the Rainbow,Decca 3231,1948,Mack the Black,MGM 30099
1940,Our Love Affair / I'm Always Chasing Rainbows,Decca 3593,1948,I Wish I Were in Love Again (w. Mickey Rooney) / Johnny One Note,MGM 30172
1940,It's a Great Day for the Irish / A Pretty Girl Milking Her Cow,Decca 3604,1948,Easter Parade (w. Fred Astaire) / A Fella With an Umbrella (w. Peter Lawford),MGM 30185
1941,The Birthday of a King / Star of the East,Decca 4050,1948,A Couple of Swells / Irving Berlin Medley (w. Fred Astaire),MGM 30186
1941,How About You? / F.D.R. Jones,Decca 4072,1948,Better Luck Next Time,MGM 30187
