Rank,Title,Studio,Actors,Gross,Extra_Data_1,Noise_Field_2,Random_Column_3
15.,The Turning Point,20th Century Fox,"Shirley MacLaine, Anne Bancroft, Tom Skerritt, Mikhail Baryshnikov and Leslie Browne","$33,600,000",147,cYEYkDwU,DJKNFJe
16.,Heroes,Universal,"Henry Winkler, Sally Field, and Harrison Ford","$33,500,000",782,JyLUK,5HdBc
17.,High Anxiety,20th Century Fox,"Mel Brooks, Madeline Kahn, Cloris Leachman, Harvey Korman, Ron Carey, Howard Morris and Dick Van Patten","$31,063,038",217,erwSeGy,3MJS2
18.,Exorcist II: The Heretic,Warner Bros.,"Linda Blair, Richard Burton, Louise Fletcher, Max von Sydow and James Earl Jones","$30,749,142",533,rVEMR,5EPDia
19.,Airport '77,Universal,"Jack Lemmon, Lee Grant and James Stewart","$30,000,000",695,qXdMTuQ,gJ4mFXa
20.,Herbie Goes to Monte Carlo,Disney,"Dean Jones, Don Knotts and Julie Sommars","$29,000,000",184,ZgHdqY,a9Qkq
