Episode #,Original air date (UK),Episode title,Guest cast,DVD # 1
1-08,10 December 1976,"\The Tale of the Big Why\""""","Derek Waring, Jenny Runacre, Roy Marsden, George A. Cooper, Geoffrey Toone, Gary Waldhorn",1.09
1-09,17 December 1976,"\Faces\""""","David de Keyser, Edward Petherbridge, Richard Leech, Michael Sheard, Donald Hewlett, Neil Hallett, David Webb, J. G. Devlin",1.08
1–10,21 December 1976,"\Gnaws\""""","Julian Holloway, Peter Cellier, Jeremy Young, Patrick Malahide, W. Morgan Sheppard, Keith Marsh",1.11
1–11,7 January 1977,"\Dirtier by the Dozen\""""","John Castle, Shaun Curry, Alun Armstrong, Michael Barrington, Brian Croucher, Stephen Moore, John Forbes-Robertson, David Purcell",1.13
1–12,14 January 1977,"\Sleeper\""""","Keith Buckley, Sara Kestelman, Prentis Hancock, Mark Jones",1.12
1–13,21 January 1977,"\Three-Handed Game\""""","Stephen Greif, Tony Vogel, David Wood, Ronald Leigh-Hunt, Annie Lambert, Hugh Morton, John Paul",1.10
