Year,Award Ceremony,Category,Film/Show,Result
2011,Filmfare Awards,Filmfare Best Supporting Actress Award,Golmaal 3,Nominated
2011,Screen Awards,Screen Award for Best Supporting Actress,Golmaal 3,Nominated
2011,Zee Cine Awards,Zee Cine Award for Best Actor in a Supporting Role – Female,Golmaal 3,Nominated
2011,Apsara Film & Television Producers Guild Awards,Apsara Award for Best Actress in a Supporting Role,Golmaal 3,Nominated
2011,12th IIFA Awards,IIFA Award for Best Supporting Actress,Golmaal 3,Nominated
