,Year,Location,Name,Guest(s) of Honour,Random_Column_1,Filler_2,Unused_3
1,1998,Linköping,ConFuse 98,Paul J. McAuley,9SJggtpt,vreAdDbh,
2,1999,Uppsala,Upsala: 1999,Michael Swanwick,qz0FazDr,BsOQvATn,
3,2000,Stockholm,NasaCon 2000,"Brian M. Stableford, John-Henri Holmberg",oax9aF,sIbAk,
4,2001,Stockholm,Fantastika 2001,"Robin Hobb, Robert Rankin, Karolina Bjällerstedt Mickos, Pierre Christin",aN0bdSFl,ohEczR,
5,2002,Linköping,ConFuse 2002,"China Miéville, Gwyneth Jones",DNWUAuVT,VVLZW,
6,2003,Uppsala,Upsala SF-möte X,"Alastair Reynolds, Ken MacLeod",7MtVQS,uVbbeDot,
7,2004,Stockholm,Swecon 2004,"M. John Harrison, Dave Lally, Tim Russ",DUTvfp,ZhQqC,
8,2005,Gothenburg,ConCeive,"Charles Stross, Erik Granström",fgIIngbs,pDENZITM,
