,Year,Location,Name,Guest(s) of Honour,Extra_Data_1,Extra_Data_2
12,2009,Stockholm,Imagicon 2,"Liz Williams, Graham Joyce",37,228
13,2010,Gothenburg,Condense,"Justina Robson, Nene Ormes",841,869
14,2011,Stockholm,Eurocon 2011,"Elizabeth Bear, Ian McDonald, John-Henri Holmberg, Jukka Halme",622,451
15,2012,Uppsala,Kontrast,"Sara Bergmark Elfgren, Mats Strandberg, Joe Abercrombie, Peter Watts, Kelly Link, Niels Dalgaard",75,507
16,2013,Stockholm,Fantastika 2013,"Lavie Tidhar, Jo Walton, Johan Anglemark, Karin Tidbeck",417,681
