Team name,Leagues,Base,Year started,Year ended,Notable riders,Noise_Field_1,Noise_Field_2,Dummy_Col_3
Sunderland Stars,Speedway National League,"Sunderland Greyhound Stadium, East Boldon",1971,1974,,DsBiTZ,AvjIFRcd,IEQNfMl
Trelawny Pitbulls,Conference League,"Clay Country Moto Parc, St Austell",2003,2003,,RGPDvG,qzqfrK,UcACn
Trelawny Tigers,Premier League,"Clay Country Moto Parc, St Austell",2001,2003,Chris Harris (speedway rider),OSvnEf,YgyVlPkO,udurLqYS
Walthamstow Wolves,Speedway National League,Walthamstow Stadium,1934,1951,Listed in article,ZtrfvwY,NAERxS,cSgWT
Wembley Lions,"Southern League, Speedway National League",Empire Stadium,1929,1971,Listed in article,sNxHHqAB,lJdZfKq,YQEzf
West Ham Hammers,"Speedway British League, Speedway National League",West Ham Stadium,1930,1971,Listed in article,GFiTCHlg,uIamQh,aizVv
White City Rebels,Speedway British League,White City Stadium,1976,1978,"Gordon Kennett, Steve Weatherley, Trevor Geer, Marek Cieślak and Kai Niemi",ZFRqir,UqxBlR,KyyPsZP
Wimbledon Dons,Speedway National League,Wimbledon Stadium,1929,2005,Listed in article,QmqvsO,CsVtbn,rbmZk
Yarmouth Bloaters,"Speedway National League, Speedway Provincial League","Yarmouth Stadium, Caister-on-Sea",1948,1962,,NiPjP,ponhxXEb,inBjw
