County,km,Intersecting road,Notes,Coordinates
Rocky View County,0,"Hwy 772 (Symons Valley Road), Range Road 22",North to MaddenSouth to Sage Hill & Evanston,51°13′4″N 114°9′52″W﻿ / ﻿51.21778°N 114.16444°W
Rocky View County,3,"Panorama Road (24 Street NW), Range Road 15",South to Evanston,51°12′45″N 114°7′5″W﻿ / ﻿51.21250°N 114.11806°W
Rocky View County,5,"14 Street NW, Range Road 14",South to Panorama Hills,51°12′45″N 114°5′41″W﻿ / ﻿51.21250°N 114.09472°W
Rocky View County,7,"Centre Street N, Range Road 13",Formerly Highway 782South to Coventry Hills,51°12′45″N 114°4′17″W﻿ / ﻿51.21250°N 114.07139°W
Rocky View County,10,"15 Street NE (Calgary), 8 Street (Airdrie), Range Road 11",BalzacSouth to Stony Industrial,51°12′45″N 114°1′29″W﻿ / ﻿51.21250°N 114.02472°W
Rocky View County,11,"Hwy 2, Range Road 10, Fifth Meridian, 114° Longitude",Grade separatedNorth to AirdrieSouth to Deerfoot Trail,51°12′45″N 114°0′5″W﻿ / ﻿51.21250°N 114.00139°W
