#,Date,Venue,Opponent,Score,Result,Competition
6.,13 April 1993,"Stadion Radomiaka Radom, Radom, Poland",Finland,1–0,2–1,International Friendly
7.,13 April 1993,"Stadion Radomiaka Radom, Radom, Poland",Finland,2–0,2–1,International Friendly
8.,19 May 1993,"Stadio Olimpico, Serravalle, San Marino",San Marino,0–1,0–3,1994 FIFA World Cup qualification
9.,19 May 1993,"Stadio Olimpico, Serravalle, San Marino",San Marino,0–2,0–3,1994 FIFA World Cup qualification
10.,17 November 1993,"Stadion Miejski, Poznań, Poland",Netherlands,1–1,1–3,1994 FIFA World Cup qualification
