Church name,Address,Community,School
Our Lady of Loretto,250 N. Union Ave.34°04′00″N 118°15′52″W﻿ / ﻿34.06667°N 118.26444°W,Los Angeles (Echo Park),K-8[42]
Our Mother of Good Counsel[43],2060 N. Vermont Ave.34°06′34″N 118°17′29″W﻿ / ﻿34.10944°N 118.29139°W,Los Angeles (Los Feliz),K-8[44]
Precious Blood,435 S. Occidental Blvd.34°03′54″N 118°17′02″W﻿ / ﻿34.06500°N 118.28389°W,Los Angeles (Westlake),K-8[45]
San Conrado Mission[46],1820 Bouett St.34°04′39″N 118°14′06″W﻿ / ﻿34.07750°N 118.23500°W,Los Angeles (Elysian Park),No
St. Basil,3611 Wilshire Blvd.34°03′42″N 118°18′11″W﻿ / ﻿34.06167°N 118.30306°W,Los Angeles (Miracle Mile),No
