District,Incumbent,Party,Firstelected,Result,Candidates
Pennsylvania 1,Harry C. Ransley,Republican,1920,Re-elected,Harry C. Ransley (R) 52.1%Joseph Marinelli (D) 47.2%Gamshei Kutlikoff (S) 0.4%Morris H. Wickman (C) 0.3%
Pennsylvania 2,James M. Beck,Republican,1927,ResignedRepublican hold,William H. Wilson (R) 54.7%James P. McGranery (D) 44.5%Harriet Norris (S) 0.6%Joseph Mackie (Proh) 0.2%
Pennsylvania 3,Alfred M. Waldron,Republican,1932,RetiredRepublican hold,Clare G. Fenerty (R) 52.0%Michael Joseph Bradley (D) 46.8%Alfred M. Waldron (Industrial Recovery) 0.6%Joseph Kazmark (S) 0.5%Rose E. Landberg (Prog) 0.1%
Pennsylvania 4,George W. Edmonds,Republican,1932,Lost re-electionDemocratic gain,J. Burrwood Daly (D) 49.6%George W. Edmonds (R) 49.2%William Eckel (S) 0.7%Sterling T. Rochester (C) 0.4%Charles Fred White (Prog) 0.08%
Pennsylvania 5,James J. Connolly,Republican,1920,Lost re-electionDemocratic gain,Frank Joseph Gerard Dorsey (D) 52.2%James J. Connolly (R) 46.7%Warren D. Mullin (S) 1.0%Arthur Braun (C) 0.2%
Pennsylvania 6,Edward L. Stokes,Republican,1931,Retired to run for GovernorDemocratic gain,Michael J. Stack (D) 50.8%Robert L. Davis (R) 48.2%John P. Innerarity (S) 0.6%Ben Gardner (C) 0.2%Romain C. Hassrick (Proh) 0.2%Benjamin J. Spang (Prog) 0.06%
Pennsylvania 7,George P. Darrow,Republican,1914,Re-elected,George P. Darrow (R) 52.7%James C. Crumlish (D) 46.4%Joseph Doerr (S) 0.7%T. Henry Walnut (Proh) 0.1%William F. Kane (Prog) 0.08%
Pennsylvania 8,James Wolfenden,Republican,1928,Re-elected,James Wolfenden (R) 57.2%John E. McDonough (D) 41.3%Edward B. Rawson (S) 1.0%C. Wilfred Conard (Proh) 0.6%
Pennsylvania 9,Oliver W. Frey,Democratic,1933,Re-elected,Oliver W. Frey (D) 50.2%Theodore R. Gardner (R) 47.6%Walter L. Huhn (S) 1.6%Manda M. Horlacker (Proh) 0.4%Steven Pukanecz (C) 0.2%
