Wrestlers:,Times:,Date:,Location:,Notes:,Irrelevant_1,Extra_Data_2
Hiroki and Yusaku Obata,1,"September 28, 2011","Tokyo, Japan",,fEJ1WU,393
Manjimaru and Takeshi Minamino,1,"March 25, 2012","Tokyo, Japan",,ib9VmOF2,507
Daisaku Shimoda and Kazushi Miyamoto,1,"April 26, 2012","Tokyo, Japan",,2mmHsrL,779
Kengo Nishimura and Tomohiko Hashimoto,1,"May 31, 2012","Tokyo, Japan",,BGXDgmR,991
Kotaro Nasu and Masato Shibata,1,"September 21, 2012","Tokyo, Japan",,jCWKUny,414
Shoichi Ichimiya and Tomohiko Hashimoto,1,"October 13, 2012","Tokyo, Japan",,5V1qv5,316
Daisaku Shimoda and Rikiya Fudo,1,"July 14, 2013","Osaka, Japan",,ufqHZS,73
Tadasuke and Tomohiko Hashimoto,1,"November 10, 2013","Osaka, Japan",,sNUEQKe2,393
