Ship,Built,In service for Cunard,Type,Tonnage,Notes
SaxoniaCarmania,1954,1954–19621962–1973,intermediatecruise,"21,637 GRT21,370 GRT","Sold to the Black Sea Shipping Company, Soviet Union 1973"
IverniaFranconia,1955,1955–19631963–1973,intermediatecruise,"21,800 GRT","Sold to the Far Eastern Shipping Company, Soviet Union 1973, scrapped 2004"
Carinthia,1956,1956–1968,intermediate,"21,800 GRT","sold to Sitmar Line 1968, scrapped 2005"
Sylvania,1957,1957–1968,intermediate,"21,800 GRT","sold to Sitmar Line 1968, scrapped 2004"
Alaunia,1960,1960–1969,cargo liner,"7,004 GRT",sold to Brocklebank Line in 1969
Queen Elizabeth 2,1969,1969–2008,express,"70,300 GRT","sold 2008, laid up in Port Rashid"
Atlantic Causeway,1969,1970–1986,container ship,"14,950 GRT",scrapped in 1986
Atlantic Conveyor,1970,1970–1982,container ship,"14,946 GRT",sunk in Falklands War 1982
