Outcome,No.,Date,Tournament,Surface,Partner,Opponents in the final,Score in the final,Unused_1
Winner,1.,9 May 2010,"Estoril Open, Estoril, Portugal",Clay,Marc López,Pablo Cuevas Marcel Granollers,"6–7(1–7), 6–4, [10–4]",
Winner,2.,25 July 2010,"International German Open, Hamburg, Germany",Clay,Marc López,Jérémy Chardy Paul-Henri Mathieu,"6–2, 2–6, [10–8]",
Runner-up,1.,1 May 2011,"Estoril Open, Estoril, Portugal",Clay,Marc López,Eric Butorac Jean-Julien Rojer,"3–6, 4–6",
Runner-up,2.,21 May 2011,"Open de Nice Côte d’Azur, Nice, France",Clay,Santiago Gonzalez,Eric Butorac Jean-Julien Rojer,"3–6, 4–6",
Runner-up,3.,24 September 2011,"BRD Năstase Țiriac Trophy, Bucharest, Romania",Clay,Julian Knowle,Daniele Bracciali Potito Starace,"6–3, 4–6, [8–10]",
Runner-up,4.,23 October 2011,"Kremlin Cup, Moscow, Russia",Hard (i),Carlos Berlocq,František Čermák Filip Polášek,"3–6, 1–6",
Winner,3.,25 February 2012,"Copa Claro, Buenos Aires, Argentina",Clay,Fernando Verdasco,Michal Mertiňák André Sá,"6–4, 6–4",
Winner,4.,4 March 2012,"Abierto Mexicano TELCEL, Acapulco, Mexico",Clay,Fernando Verdasco,Marcel Granollers Marc López,"6–3, 6–4",
Runner-up,5.,6 May 2012,"Estoril Open, Estoril, Portugal",Clay,Julian Knowle,Aisam-ul-Haq Qureshi Jean-Julien Rojer,"5–7, 5–7",
