#,Title,Songwriters,Producer(s),Performer (s)
6,"\Keep Ya Head Up\""""","T. Shakur, D. Anderson, S. Vincent, R. Troutman",DJ Daryl,2Pac
7,"\Code of the Streets\""""","K. Elam, C. Martin, R. Russell",DJ Premier,Gang Starr
8,"\Rebirth of Slick (Cool Like Dat)\""""","I. Butler, C. Irving, M. Vieira, J. Williams",Butterfly,Digable Planets
9,"\Officer\""""","T. Hardson, J. Martinez, R. Robinson, D. Stewart, E. Wilcox",J-Swift,The Pharcyde
10,"\This Is How We Do It\""""","M. Jordan, O. Pierce, R. Walters","Montell Jordan, Oji Pierce",Montell Jordan
