Rank,Team,Names,Time,Qualification,Random_Column_1,Dummy_Col_2
13,Denmark,Frederik BertelsenJimmi MadsenMichael NielsenJacob Piil,4:16.175,,HnGAHm4,LkpALqg
14,Argentina,Walter PerezEdgardo SimonGonzalo GarciaGabriel Curuchet,4:20.840,,DzQ3M,PNCDkBmL
15,South Korea,Dae-Hong ChunYoung ChungJong-Mo KimYounk-Sik Noh,4:25.215,,45lNGI,QVDUPIA
16,Chile,Jose MedinaLuis SepulvedaMarco ArriagadaMarcelo Arriagada,4:25.960,,dSlhfh0v,KoXeF
17,Colombia,John GarciaMarlon PerezYovani LopezJos Velasquez de la Cuesta,4:26.400,,TE7JkxG,hpVafC
