Pos,Class,No,Team,Drivers,Chassis,Engine,Random_Column_1,Random_Column_2
44,T,93,Hervé Poulain,Hervé Poulain Sam Posey Jean Guichet,BMW 3.0CSL,BMW 3.5L I6,iCPrmXMG,Y6mEYz0
45,S2.0,26,Elf Switzerland,Marie-Claude Charmasson Lella Lombardi,Renault-Alpine A441,Renault 2.0L V6,Mk4Pqj,SQVATn
46,S3.0,18,Sigma Automotive Co. Ltd.,Hiroshi Fushida Harukuni Takahashi,Sigma MC75,Toyota 2.3L Turbo I4,7e4iqt,FQwoN
47,GT,16,Joest Racing / Tebernum,Clemens Schickentanz Hartwig Bertrams,Porsche 911 Carrera RSR,Porsche 3.0L Flat-6,GX9cP,Crk6cS
48,GT,96,Bonnemaison - Thiaw,Lucien Nageotte Gérard Picard,Porsche 911 Carrera RSR,Porsche 3.0L Flat-6,u9enaqUt,0KO059BL
49,T,95,Shark Team,Jean-Claude Guérie Dominique Fornage,Ford Capri RS,Ford 3.0L V6,Xmyks7KE,X5nVi
