Number/name,Wheel arrangement,Builder,Year,Disposition andLocation
6California,4-4-0,H. J. Booth at Union Iron Works,7/1865,"To Southern Pacific #6, #1303. Rebuilt 1873. Scrapped in 1911."
7Atlantic,4-4-0,H.J. Booth at Union Iron Works,1865,"To Southern Pacific #7, #1231, scrapped in 1895."
8Union,0-4-0,H.J. Booth at Union Iron Works,6/1867,"To Southern Pacific #8, #1002. Unknown."
9Donahue,4-4-0,Cooke Locomotive and Machine Works,4/1870,To Southern Pacific #9. Unknown.
10Newhall,,,,To Southern Pacific #10. Unknown.
