Festival,Year,Award,Nominee,Result,Noise_Field_1,Unused_2
Monaco International Film Festival,2011,Best Short Animation,N/A,Won,sHmskjJ,
Milan International Film Festival,2012,Short Film Award,N/A,Nominated,gGNWc,
Shorts In Paradise Film Festival,2012,Runner Up Award,N/A,Won,LiMKxll,
WorldFest Houston International Film Festival and Video Festival,2012,Special Jury Remi,N/A,Won,vfzgAy,
Janison Short Sharp Film Festival,2012,Animation Grand Prize,N/A,Won,diGHbEjQ,
Create Design Awards,2012,Motion Category,N/A,Nominated,OVvLOV,
St Kilda Film Festival,2013,Best Comedy,N/A,Won,gBEGbZcK,
