Film,Year,Role,Language
Omul zilei (The Man of the Day),1997,,Romanian
"Ulysses' Gaze(original Greek title: Το Βλέμμα του Οδυσσέα, To Vlemma tou Odyssea)",1995,playing opposite Harvey Keitel as Ulysses' wife,English / Greek
Siódmy pokój (The Seventh Room),1995,Edith Stein (the starring role),Hungarian
Nostradamus,1994,Helen,English
"Trahir (Betrayal, Romanian title: A trada)",1993,woman in prison,French / Romanian
"Casa din vis (\The House from the Dream\"")""",1993,,Romanian
Cel mai iubit dintre pămînteni (The Earth's Most Beloved Son)based on Marin Preda's novel Cel mai iubit dintre pământeni,1993,,Romanian
Balanţa (The Oak),1992,Nela (the starring role),Romanian
Rămînerea (Forgotten by God),1992,,Romanian
