Year,Film Title,Genre,Cast,Notes,Noise_Field_1
1988,Tarka,A murder mystery,"Shankar Nag, Devaraj",Filmfare Award for Best Director – Kannada,iiIpEKVF
1990,Utkarsha,Thriller,"Dr.Ambareesh, Devaraj",,lrAkDK
1991,Sangarsha,Thriller,"Dr.Vishnuvardhan, Geetha",,IJRDusC
1994,Nishkarsha,Real time thriller,"Dr.Vishnuvardhan, Ananth Nag",Karnataka State Film Award for Best Screenplay,dgIaP
1996,Beladingala Baale,Love story,Ananth Nag,Filmfare Award for Best Director – KannadaKarnataka State Film Award for Best Screenplay,PCjPdXvS
1997,Nammoora Mandara Hoove,Love story,"Ramesh Aravind, Shivrajkumar, Prema",Karnataka State Film Award for Best Screenplay,jqdAF
1998,Prema Raaga Haadu Gelati,Love story,"Shivrajkumar, Nivedita Jain, Srinath",,ReCWETY
1999,Pratyartha,Thriller,"Ramesh Aravind, Raghuvaran, Sudeep",,aUSptdp
